{
  "protocol": "jig.status-provider/v1",
  "provider": {
    "id": "factorish.rails-rewrite",
    "adapter_version": "0.1.0",
    "display_name": "Factorish Rails rewrite status provider",
    "extensions": {
      "factorish.rails-rewrite": {
        "rails_version": "4.2.11"
      }
    }
  },
  "observed_at_ms": 1785142200000,
  "outcome": "complete",
  "inputs": [
    {
      "name": "target",
      "kind": "git",
      "revision": "2f36de11aef3e3994a833e900e609d1a85676825"
    },
    {
      "name": "legacy",
      "kind": "git",
      "path": "legacy/hocr",
      "revision": "389b1fa45a6373c036103efe1cde365056aac4f2"
    }
  ],
  "work_packages": [
    {
      "id": "WP-0042",
      "title": "Rewrite invoice export",
      "specification": {
        "state": "ready",
        "category": "ready",
        "source": {
          "path": "docs/delivery/work-packages/WP-0042.yml",
          "line": 1
        },
        "digest": "sha256:04aa85d33e420dc387d07c93a43c3622bc9759ab74e3cf32afc7a5534b940b15"
      },
      "implementation": {
        "state": "in_progress",
        "category": "active",
        "source": {
          "path": "docs/delivery/progress/WP-0042.yml",
          "line": 1
        }
      },
      "verification": {
        "state": "unverified",
        "category": "pending"
      },
      "dependencies": [
        "WP-0012"
      ],
      "acceptance_checks": [
        {
          "ordinal": 1,
          "id": "invoice_export_matches_legacy",
          "state": "covered",
          "category": "complete",
          "target": "invoice_export_matches_legacy",
          "source": {
            "path": "docs/delivery/work-packages/WP-0042.yml",
            "line": 42
          }
        }
      ],
      "blockers": [
        {
          "code": "dependency_not_verified",
          "message": "WP-0012 has not been verified",
          "related_work_package": "WP-0012",
          "source": {
            "path": "docs/delivery/work-packages/WP-0042.yml",
            "line": 17
          }
        }
      ],
      "evidence": [
        {
          "kind": "legacy_source",
          "reference": "legacy/hocr/app/models/invoice.rb",
          "digest": "sha256:910f733c1f2f1cbb2a4d1d86e1377538a9ae0b6ec00611ad9af03a6ef6f7031f"
        }
      ],
      "extensions": {
        "factorish.rails-rewrite": {
          "compatibility_confidence": 0.92
        }
      }
    }
  ],
  "diagnostics": []
}
